{
  "schema_version": "1.3",
  "rail": "run_load",
  "outcome": "technical_failure",
  "run_id": "crm-load-wi158",
  "workspace_id": "unknown",
  "datasets": [],
  "messages": [
    "CRM load failed at definition: Fabric API request failed with HTTP 404"
  ],
  "timestamp": "2026-09-03T13:04:26.442387Z"
}
