{
  "schema_version": "1.3",
  "rail": "run_load",
  "outcome": "technical_failure",
  "run_id": "crm-load-wi158",
  "workspace_id": "unknown",
  "datasets": [],
  "messages": [
    "CRM load failed at notebook_run: Fabric notebook run failed with status Failed (unknown)"
  ],
  "timestamp": "2026-09-03T14:41:06.199435Z"
}
